{
  "$schema": "https://json-schema.org/draft/2020-12/schema",
  "$id": "https://evofitbench.invalid/schemas/mono_ci_psi_positive_add_c2_profile_v2.schema.json",
  "title": "C2 V2 TEST_ONLY exact-set bounded retain and positive ADD profile",
  "type": "object",
  "additionalProperties": false,
  "required": [
    "schema_version",
    "profile_id",
    "classification",
    "evaluation_as_of",
    "scope",
    "selected_obligation",
    "additional_retain_obligations",
    "canonical_mandatory_projection",
    "author_declared_exact_pair_semantics",
    "candidate_template",
    "stage_contract",
    "cost_rule",
    "comparison",
    "exact_set_applicability",
    "research_boundaries"
  ],
  "properties": {
    "schema_version": {
      "const": 2
    },
    "profile_id": {
      "const": "MONO_CI_A05_POSITIVE_ADD_C2_TEST_ONLY_PROFILE_V2"
    },
    "classification": {
      "const": "TEST_ONLY_AUTHOR_DECLARED_SCOPED_INPUT"
    },
    "evaluation_as_of": {
      "type": "string",
      "format": "date-time"
    },
    "scope": {
      "type": "object",
      "additionalProperties": false,
      "required": [
        "id",
        "architecture_state"
      ],
      "properties": {
        "id": {
          "const": "application"
        },
        "architecture_state": {
          "const": "A0_5_MODULE_DATA_OWNERSHIP"
        }
      }
    },
    "selected_obligation": {
      "type": "object",
      "additionalProperties": false,
      "required": [
        "id",
        "criterion",
        "mandatory",
        "author_rationale"
      ],
      "properties": {
        "id": {
          "const": "AC_DATA_OWNERSHIP"
        },
        "criterion": {
          "const": "architecture_compliance"
        },
        "mandatory": {
          "const": true
        },
        "author_rationale": {
          "type": "string",
          "minLength": 20
        }
      }
    },
    "additional_retain_obligations": {
      "const": [
        {
          "id": "AC_MODULE_GRAPH",
          "mandatory": true,
          "representation_id": "REP_RECON_B0_A04_MODULE_GRAPH_CI_V1",
          "evaluator_id": "AC_MODULE_GRAPH",
          "configuration_path": "architecture/acceptance/a1/module_graph_v1.yaml",
          "configuration_sha256": "1abae6871a477ff2a07685ad645a70defa2f1ac6745598ae4cdc35aab4e95bf6",
          "evaluator_source_manifest_sha256": "5c17373ba8896ef0c443d826bd0064168ec7c5759c7973f9602b6c2c715b169c",
          "source_commit_sha": "37176a42cc099f1f159dc137b85fe3e32b8290d5",
          "application_tree_sha": "007196f68652bc13f6798805793ffdfae96f95f7",
          "c1_pair_status": "VALID_TEST_ONLY",
          "c1_compliance": "COMPLIANT",
          "c1_process_exit_code": 0,
          "c1_inspection_status": "COMPLETE",
          "c1_expected_inspection_count": 31,
          "c1_inspected_count": 31,
          "adequacy_authority": "AUTHOR_DECLARED_TEST_ONLY_NOT_INDEPENDENT"
        },
        {
          "id": "AC_PUBLIC_API",
          "mandatory": true,
          "representation_id": "REP_RECON_B0_A04_PUBLIC_API_CI_V1",
          "evaluator_id": "AC_PUBLIC_API",
          "configuration_path": "architecture/acceptance/a1/public_api_v1.yaml",
          "configuration_sha256": "8853c3a933b23f698c7ba7c5b6e511f292e8d9285dc0de4378741c53e466f7bb",
          "evaluator_source_manifest_sha256": "5c17373ba8896ef0c443d826bd0064168ec7c5759c7973f9602b6c2c715b169c",
          "source_commit_sha": "37176a42cc099f1f159dc137b85fe3e32b8290d5",
          "application_tree_sha": "007196f68652bc13f6798805793ffdfae96f95f7",
          "c1_pair_status": "VALID_TEST_ONLY",
          "c1_compliance": "COMPLIANT",
          "c1_process_exit_code": 0,
          "c1_inspection_status": "COMPLETE",
          "c1_expected_inspection_count": 31,
          "c1_inspected_count": 31,
          "adequacy_authority": "AUTHOR_DECLARED_TEST_ONLY_NOT_INDEPENDENT"
        }
      ]
    },
    "canonical_mandatory_projection": {
      "type": "object",
      "additionalProperties": false,
      "required": [
        "selected_obligation_is_true",
        "only_selected_rows_are_mandatory_within_test_scope",
        "additional_test_only_active_obligations",
        "other_applicability_status",
        "global_denominator_or_coverage_claim"
      ],
      "properties": {
        "selected_obligation_is_true": {
          "const": true
        },
        "only_selected_rows_are_mandatory_within_test_scope": {
          "const": true
        },
        "additional_test_only_active_obligations": {
          "const": [
            "AC_MODULE_GRAPH",
            "AC_PUBLIC_API"
          ]
        },
        "other_applicability_status": {
          "const": "UNKNOWN"
        },
        "global_denominator_or_coverage_claim": {
          "const": false
        }
      }
    },
    "author_declared_exact_pair_semantics": {
      "type": "object",
      "additionalProperties": false,
      "required": [
        "trust_scope",
        "independent_verification",
        "positive_control_pairs"
      ],
      "properties": {
        "trust_scope": {
          "const": "TEST_ONLY"
        },
        "independent_verification": {
          "const": false
        },
        "positive_control_pairs": {
          "const": [
            {
              "evaluator_id": "AC_PUBLIC_API",
              "obligation_id": "AC_PUBLIC_API"
            },
            {
              "evaluator_id": "AC_MODULE_GRAPH",
              "obligation_id": "AC_MODULE_GRAPH"
            },
            {
              "evaluator_id": "AC_DATA_OWNERSHIP",
              "obligation_id": "AC_DATA_OWNERSHIP"
            }
          ]
        }
      }
    },
    "candidate_template": {
      "type": "object",
      "additionalProperties": false,
      "required": [
        "representation_id",
        "criterion",
        "stage_label",
        "method_stage_token",
        "evaluator_id",
        "covers",
        "applicability_scope_id",
        "configuration_path",
        "artifact_kind"
      ],
      "properties": {
        "representation_id": {
          "const": "REP_POSITIVE_ADD_AC_DATA_OWNERSHIP"
        },
        "criterion": {
          "const": "architecture_compliance"
        },
        "stage_label": {
          "const": "CI_TEST"
        },
        "method_stage_token": {
          "const": "ci_test"
        },
        "evaluator_id": {
          "const": "AC_DATA_OWNERSHIP"
        },
        "covers": {
          "const": [
            "AC_DATA_OWNERSHIP"
          ]
        },
        "applicability_scope_id": {
          "const": "application"
        },
        "configuration_path": {
          "const": "architecture/acceptance/a1/data_ownership_v1.yaml"
        },
        "artifact_kind": {
          "const": "A1 evaluator source-manifest bytes"
        }
      }
    },
    "stage_contract": {
      "type": "object",
      "additionalProperties": false,
      "required": [
        "obligations"
      ],
      "properties": {
        "obligations": {
          "const": {
            "AC_DATA_OWNERSHIP": [
              "ci_test"
            ],
            "AC_MODULE_GRAPH": [
              "ci_test"
            ],
            "AC_PUBLIC_API": [
              "ci_test"
            ]
          }
        }
      }
    },
    "cost_rule": {
      "type": "object",
      "additionalProperties": false,
      "required": [
        "unit",
        "historical_source",
        "historical_source_sha256",
        "historical_sample_status",
        "evaluator_id",
        "conditions",
        "condition_source_commits",
        "warmups_excluded",
        "historical_measured_calls",
        "historical_max_process_duration_ms",
        "margin_fraction",
        "round_up_increment_ms",
        "fixed_max_incremental_cost_ms",
        "fixed_max_search_nodes",
        "candidate_cost_binding"
      ],
      "properties": {
        "unit": {
          "const": "elapsed wall-clock milliseconds per added evaluator invocation"
        },
        "historical_source": {
          "const": "V2_RELEASE_ASSET:analysis/evaluator-samples.csv"
        },
        "historical_source_sha256": {
          "const": "2bbff33702491cd0238271fa4c718316378586f5f7eb6af0271cf7baef25e7a7"
        },
        "historical_sample_status": {
          "const": "MEASURED"
        },
        "evaluator_id": {
          "const": "AC_DATA_OWNERSHIP"
        },
        "conditions": {
          "const": [
            "A0_5_CLEAN",
            "EXISTING_NEGATIVE_PROBE"
          ]
        },
        "condition_source_commits": {
          "const": {
            "A0_5_CLEAN": "a349d19fb89b577e6799e9736ed4ce0acc572166",
            "EXISTING_NEGATIVE_PROBE": "5ace86095bda794c9576047c80b9267e70cd0f26"
          }
        },
        "warmups_excluded": {
          "const": true
        },
        "historical_measured_calls": {
          "const": 20
        },
        "historical_max_process_duration_ms": {
          "const": 177.215
        },
        "margin_fraction": {
          "const": 0.25
        },
        "round_up_increment_ms": {
          "const": 25
        },
        "fixed_max_incremental_cost_ms": {
          "const": 225
        },
        "fixed_max_search_nodes": {
          "const": 2
        },
        "candidate_cost_binding": {
          "const": "evaluator source-manifest SHA-256"
        }
      }
    },
    "comparison": {
      "type": "object",
      "additionalProperties": false,
      "required": [
        "c0_reference",
        "c1_recovery_release",
        "c1_recovery_archive_sha256",
        "warmup_repetitions",
        "c2_repetitions",
        "same_clean_source_and_existing_negative_probe",
        "candidate_is_exercised_only_if_method_materializes_it"
      ],
      "properties": {
        "c0_reference": {
          "const": "experiments/execution/mono-ci-b0-psi-delta-a5-owner-authorized-v2/analysis/OWNER_AUTHORIZED_RESULTS_UK_V2.md"
        },
        "c1_recovery_release": {
          "const": "https://github.com/Pan14ek/evofit-bench/releases/tag/mono-ci-a05-positive-add-recovery-40612830900-1"
        },
        "c1_recovery_archive_sha256": {
          "const": "3c3aaaa0ab675ec33158cebba9eae565bacab973a09e98ba5e48273952c760a2"
        },
        "warmup_repetitions": {
          "const": 1
        },
        "c2_repetitions": {
          "const": 3
        },
        "same_clean_source_and_existing_negative_probe": {
          "const": true
        },
        "candidate_is_exercised_only_if_method_materializes_it": {
          "const": true
        }
      }
    },
    "research_boundaries": {
      "type": "object",
      "additionalProperties": false,
      "required": [
        "canonical_catalog_modified",
        "frozen_v2_inputs_modified",
        "method_algorithm_modified",
        "measured_da01_authorized",
        "g1",
        "g4",
        "p_algorithm_status"
      ],
      "properties": {
        "canonical_catalog_modified": {
          "const": false
        },
        "frozen_v2_inputs_modified": {
          "const": false
        },
        "method_algorithm_modified": {
          "const": true
        },
        "measured_da01_authorized": {
          "const": false
        },
        "g1": {
          "const": "INCOMPLETE"
        },
        "g4": {
          "const": "NOT_AUTHORIZED"
        },
        "p_algorithm_status": {
          "const": "NOT_READY"
        }
      }
    },
    "exact_set_applicability": {
      "type": "object",
      "additionalProperties": false,
      "required": [
        "mode",
        "selected_obligation_ids",
        "outside_scope_status",
        "universal_or_family_closure",
        "method_version",
        "rationale"
      ],
      "properties": {
        "mode": {
          "const": "EXACT_SELECTED_OBLIGATIONS_ONLY"
        },
        "selected_obligation_ids": {
          "const": [
            "AC_DATA_OWNERSHIP",
            "AC_MODULE_GRAPH",
            "AC_PUBLIC_API"
          ]
        },
        "outside_scope_status": {
          "const": "UNKNOWN"
        },
        "universal_or_family_closure": {
          "const": false
        },
        "method_version": {
          "const": "P_GOVERNED_ADAPTATION_DEVELOPMENT_V2_TEST_ONLY_EXACT_SET"
        },
        "rationale": {
          "type": "string",
          "minLength": 40
        }
      }
    }
  }
}
